{"schema_version":"1.0","task_id":"TASK-0001","decision_unit_id":"DU-001","options":[{"option_id":"OPT-01","description":"Use JSON Schema","benefit":"Portable","cost":"Schema maintenance","risk":"Version drift","recommended":true},{"option_id":"OPT-02","description":"Use handwritten checks","benefit":"Direct control","cost":"More code","risk":"Inconsistent errors","recommended":false}],"generated_at":"2026-08-20T05:00:00Z"}
